{
  "$schema": "http://json-schema.org/draft-07/schema#",
  "$id": "https://ai-qa-pipeline/schemas/context.schema.json",
  "title": "Pipeline Run Context",
  "description": "Manifest for a single pipeline run. See docs/context-json-guide.md. The boolean form of each review_gates entry is the Phase 1 baseline; the object form is reserved for the Phase 2 audit-field extension (oneOf accepts both, backward-compatible).",
  "type": "object",
  "additionalProperties": false,
  "required": [
    "schema_version",
    "run_id",
    "story",
    "acceptance_criteria",
    "ambiguities",
    "risks",
    "artifact_paths",
    "review_gates",
    "status"
  ],
  "properties": {
    "schema_version": {
      "type": "string",
      "description": "Version of this schema the document conforms to. Phase 1 uses '1.0'.",
      "pattern": "^[0-9]+\\.[0-9]+(\\.[0-9]+)?$"
    },
    "run_id": {
      "type": "string",
      "description": "Unique per-run identifier. Phase 1 convention: ISO-8601-ish timestamp + short hash, e.g. 2026-05-28T14-32-01Z-a1b2c3d.",
      "minLength": 1
    },
    "story": {
      "type": "object",
      "additionalProperties": false,
      "required": ["id", "title", "source", "path"],
      "properties": {
        "id": {
          "type": "string",
          "description": "Top of the traceability chain. STORY-XXX for manual mode, the Jira issue key for Jira mode.",
          "pattern": "^(STORY-[0-9]+|[A-Z][A-Z0-9_]*-[0-9]+)$"
        },
        "title": { "type": "string", "minLength": 1 },
        "source": { "type": "string", "enum": ["manual", "jira"] },
        "path": {
          "type": "string",
          "description": "Relative path to the local Markdown copy of the story.",
          "minLength": 1
        },
        "description": { "type": "string" },
        "jira_issue_key": {
          "type": "string",
          "description": "Required when source == 'jira'. Equal to story.id in that case.",
          "pattern": "^[A-Z][A-Z0-9_]*-[0-9]+$"
        }
      },
      "allOf": [
        {
          "if": { "properties": { "source": { "const": "jira" } } },
          "then": { "required": ["jira_issue_key"] }
        }
      ]
    },
    "acceptance_criteria": {
      "type": "array",
      "description": "One AC per element. The array index is the canonical position used by risks[].related_acs.",
      "items": { "type": "string", "minLength": 1 }
    },
    "ambiguities": {
      "type": "array",
      "items": {
        "type": "object",
        "additionalProperties": false,
        "required": ["description", "blocking"],
        "properties": {
          "description": { "type": "string", "minLength": 1 },
          "blocking": { "type": "boolean" }
        }
      }
    },
    "risks": {
      "type": "array",
      "description": "First traceability anchor after the story. Each entry gets a RISK-XXX id.",
      "items": {
        "type": "object",
        "additionalProperties": false,
        "required": ["risk_id", "description", "severity", "related_acs"],
        "properties": {
          "risk_id": {
            "type": "string",
            "pattern": "^RISK-[0-9]+$"
          },
          "description": { "type": "string", "minLength": 1 },
          "severity": { "type": "string", "enum": ["low", "medium", "high"] },
          "related_acs": {
            "type": "array",
            "description": "Indices (0-based) into acceptance_criteria.",
            "items": { "type": "integer", "minimum": 0 }
          }
        }
      }
    },
    "code_change_context": {
      "type": "object",
      "additionalProperties": false,
      "description": "OPTIONAL (Phase 3 TG15, Improvement 1). SECONDARY context only: the diff of a linked PR, used to sharpen regression scope and risk prioritization. It NEVER defines expected behavior — acceptance_criteria remain the source of truth (CLAUDE.md §3.8). Populated by the Analyst (Mode B) only when the Jira story has a linked PR; absent otherwise (the pipeline runs identically with no diff). Filled via the read-only GitHub MCP; no custom diff engine, no deploy/ECR infra.",
      "required": ["linked_pr", "base_sha", "head_sha", "changed_files"],
      "properties": {
        "linked_pr": {
          "type": "string",
          "description": "URL of the linked pull request, e.g. https://github.com/org/repo/pull/123."
        },
        "base_sha": {
          "type": "string",
          "description": "The base/target SHA (the 'deployed' side). May be a configured branch like main."
        },
        "head_sha": {
          "type": "string",
          "description": "The PR head SHA."
        },
        "changed_files": {
          "type": "array",
          "items": {
            "type": "object",
            "additionalProperties": false,
            "required": ["path", "change_type"],
            "properties": {
              "path": { "type": "string", "minLength": 1 },
              "change_type": {
                "type": "string",
                "enum": ["added", "modified", "deleted", "renamed"]
              },
              "related_risk_ids": {
                "type": "array",
                "description": "Optional. RISK-XXX this changed file maps to, linking code change -> risk for regression prioritization.",
                "items": { "type": "string", "pattern": "^RISK-[0-9]+$" }
              }
            }
          }
        },
        "summary": {
          "type": "string",
          "description": "Short LLM summary of what the diff does, in the Analyst's own words. Secondary context, not a requirement."
        },
        "fetched_at": {
          "type": "string",
          "description": "ISO 8601 timestamp of when the diff was fetched."
        }
      }
    },
    "prompt_versions": {
      "type": "object",
      "description": "OPTIONAL (Phase 3 TG8, prompt versioning). Records which agent prompt VERSION drove this run, keyed by agent name (the frontmatter `name:` of agents/*.md), value = that file's `version:` (semver). This pins a run to the exact prompts that produced it, so a metrics/regression delta can be attributed to a specific prompt change. Absent on older runs (the pipeline runs identically without it). Keys are agent names; this object is NOT a closed enum so new agents can register without a schema change.",
      "additionalProperties": {
        "type": "string",
        "description": "Semantic version of the agent prompt used (matches agents/<name>.md frontmatter `version:`).",
        "pattern": "^[0-9]+\\.[0-9]+\\.[0-9]+$"
      }
    },
    "artifact_paths": {
      "type": "object",
      "additionalProperties": false,
      "description": "Manifest of files this run produces. Empty string means 'not yet produced'.",
      "required": [
        "test_cases",
        "planner_brief",
        "playwright_spec",
        "generated_test",
        "execution_results",
        "html_report",
        "traces",
        "screenshots",
        "failure_analysis",
        "release_report_md",
        "release_report_json",
        "bug_drafts_dir"
      ],
      "properties": {
        "test_cases": { "type": "string" },
        "planner_brief": { "type": "string" },
        "playwright_spec": { "type": "string" },
        "generated_test": { "type": "string" },
        "execution_results": { "type": "string" },
        "html_report": { "type": "string" },
        "traces": { "type": "string" },
        "screenshots": { "type": "string" },
        "failure_analysis": { "type": "string" },
        "release_report_md": { "type": "string" },
        "release_report_json": { "type": "string" },
        "bug_drafts_dir": { "type": "string" }
      }
    },
    "review_gates": {
      "type": "object",
      "additionalProperties": false,
      "description": "Phase 1 form uses booleans. Phase 2 (TG6) introduces an optional audit-field object alongside the boolean via oneOf; both forms remain valid. Phase 2 (TG7) adds the OPTIONAL qa_scope_approved gate that consolidates Gates 1 and 2 — see docs/review-gates.md. The four per-gate fields stay required for backward compatibility; qa_scope_approved is additive and never replaces code_reviewed (Gate 4 never consolidates).",
      "required": [
        "requirements_reviewed",
        "test_scope_reviewed",
        "specs_reviewed",
        "code_reviewed"
      ],
      "properties": {
        "requirements_reviewed": { "$ref": "#/definitions/gateValue" },
        "test_scope_reviewed": { "$ref": "#/definitions/gateValue" },
        "specs_reviewed": { "$ref": "#/definitions/gateValue" },
        "code_reviewed": { "$ref": "#/definitions/gateValue" },
        "qa_scope_approved": {
          "$ref": "#/definitions/gateValue",
          "description": "OPTIONAL (Phase 2 TG7). When present and passed, consolidates Gate 1 (requirements_reviewed) and Gate 2 (test_scope_reviewed) into a single approval. The two underlying gates remain present and valid (deprecated, not removed). Same boolean | audit-object shape as the other gates. Gate 4 (code_reviewed) is NEVER consolidated into this."
        }
      }
    },
    "gate_decisions": {
      "type": "array",
      "description": "OPTIONAL (continuous improvement). An append-only LOG of gate decision events for this run — both approvals AND rejections. review_gates holds the final state; this holds the history, so metrics can count rejections per run (the Phase 3 retro gap: Gate 3/4 rejection rate was 'not tracked'). A rejection is recorded, then a later approval is appended when the human re-approves after rework. Absent on older runs; the pipeline runs identically without it.",
      "items": {
        "type": "object",
        "additionalProperties": false,
        "required": ["gate", "decision", "decided_at"],
        "properties": {
          "gate": {
            "type": "string",
            "description": "Which gate. Matches a review_gates key.",
            "enum": [
              "requirements_reviewed",
              "test_scope_reviewed",
              "specs_reviewed",
              "code_reviewed",
              "qa_scope_approved"
            ]
          },
          "decision": {
            "type": "string",
            "enum": ["approved", "rejected"]
          },
          "decided_at": {
            "type": "string",
            "description": "ISO 8601 timestamp of the decision."
          },
          "opened_at": {
            "type": "string",
            "description": "OPTIONAL (gate telemetry). ISO 8601 timestamp of when this gate review STARTED — the moment the gate brief / artifacts were first presented to the reviewer. Enables gate cost in minutes (decided_at - opened_at). Absent on older runs; the pipeline runs identically without it."
          },
          "reviewer": { "type": ["string", "null"] },
          "notes": {
            "type": ["string", "null"],
            "description": "Why — especially for a rejection (what must change before re-review)."
          }
        }
      }
    },
    "status": {
      "type": "string",
      "enum": ["draft", "in_progress", "completed", "blocked"]
    }
  },
  "definitions": {
    "gateValue": {
      "oneOf": [
        { "type": "boolean" },
        {
          "type": "object",
          "additionalProperties": false,
          "required": ["status"],
          "properties": {
            "status": { "type": "boolean" },
            "reviewer": { "type": ["string", "null"] },
            "reviewed_at": {
              "type": ["string", "null"],
              "description": "ISO 8601 timestamp, or null when not yet recorded."
            },
            "opened_at": {
              "type": ["string", "null"],
              "description": "OPTIONAL (gate telemetry). ISO 8601 timestamp of when the review started (gate brief first presented), or null when not recorded. Enables gate cost in minutes (reviewed_at - opened_at)."
            },
            "notes": { "type": ["string", "null"] }
          }
        }
      ]
    }
  }
}
